{
  "schema_version": "1.0",
  "id": "REL-001",
  "project_id": "PRJ-001",
  "owner_batch": "B05",
  "title": "Example release",
  "status": "proposed",
  "revision": 1,
  "candidate_sha": "0000000000000000000000000000000000000000",
  "included_requirement_ids": [],
  "acceptance_ids": [],
  "unresolved_blockers": [],
  "founder_approval_ref": "REQ-001"
}
